<?xml version="1.0" encoding="UTF-8"?>
<!-- 
 
      Copyright 2019 Jochen Wiedmann
 
   Licensed under the Apache License, Version 2.0 (the "License");
   you may not use this file except in compliance with the License.
   You may obtain a copy of the License at
  
       http://www.apache.org/licenses/LICENSE-2.0
  
   Unless required by applicable law or agreed to in writing, software
   distributed under the License is distributed on an "AS IS" BASIS,
   WITHOUT WARRANTIES OR CONDITIONS OF ANY KIND, either express or implied.
   See the License for the specific language governing permissions and
   limitations under the License.

-->
<xs:schema xmlns:xs="http://www.w3.org/2001/XMLSchema" targetNamespace="http://namespaces.github.com/jochenw/qse/lin/core/plugins/1.0.0" xmlns:tns="http://namespaces.github.com/jochenw/qse/lin/core/plugins/1.0.0" elementFormDefault="qualified">
  <xs:element name="qse-lin-plugins">
    <xs:complexType>
      <xs:sequence>
        <xs:element name="plugin" minOccurs="0" maxOccurs="unbounded">
          <xs:complexType>
            <xs:sequence>
              <xs:element name="description" minOccurs="0" maxOccurs="unbounded">
                <xs:complexType>
                  <xs:simpleContent>
                    <xs:extension base="xs:string"/>
                  </xs:simpleContent>
                </xs:complexType>
              </xs:element>
              <xs:element name="property" minOccurs="0" maxOccurs="unbounded">
                <xs:complexType>
                  <xs:simpleContent>
                    <xs:extension base="xs:string">
                      <xs:attribute name="name" type="xs:string" use="required"/>
                      <xs:attribute name="value" type="xs:string" use="optional"/>
                    </xs:extension>
                  </xs:simpleContent>
                </xs:complexType>
              </xs:element>
            </xs:sequence>
            <xs:attribute name="id" type="xs:string" use="required"/>
            <xs:attribute name="name" type="xs:string" use="optional"/>
            <xs:attribute name="class" type="xs:string" use="optional"/>
            <xs:attribute name="familyId" type="xs:string" use="optional"/>
            <xs:attribute name="override" type="xs:string" use="optional" default="false"/>
            <xs:attribute name="type" use="required">
              <xs:simpleType>
                <xs:restriction base="xs:string">
                  <xs:enumeration value="family"/>
                  <xs:enumeration value="license"/>
                  <xs:enumeration value="matcher"/>
                  <xs:enumeration value="archive"/>
                  <xs:enumeration value="exclusion"/>
                </xs:restriction>
              </xs:simpleType>
            </xs:attribute>
          </xs:complexType>
        </xs:element>
      </xs:sequence>
    </xs:complexType>
  </xs:element>
</xs:schema>
